{
  "author": "Арина",
  "category": "Межличностные отношения",
  "content": "Простое, но мощное упражнение называется «Непрерывное слушание». Нам всем нужно чувствовать, что нас слышат,\nпонимают и заботятся о нас, и это упражнение может помочь и Вам, и Вашему партнеру ощутить это.\n\nУстановите таймер для этого упражнения (обычно достаточно трех-пяти минут) и дайте вашему партнеру выговориться.\nВы можете говорить о чем угодно, что на уме: о работе, школе, детях, друзьях или семье, стрессе.\n\nПока партнер говорит, ваша задача – делать одно и только одно: слушать. Не говорите вообще, пока не сработает\nтаймер. Просто слушайте своего партнера и впитывайте все это. Хотя Вы не можете говорить в течение этого\nвремени, Вы вольны оказывать своему партнеру невербальную поддержку или сочувствие с помощью языка тела, мимики\nили взглядов.\n\nКогда время закончится, поменяйтесь ролями и повторите упражнение.\n\n**Источник**: https://positivepsychology.com/couples-therapy-worksheets-activities/#exercises-couples-therapy",
  "date": "2023-02-15",
  "docx_url": "https://docs.google.com/document/d/1qeu1zegg4qf58vZ-rze0A6H5jnvgzFOG/edit#heading=h.30j0zll",
  "featured_image": "/images/Techniques/для пар прослушивание.png",
  "short_description": "Упражнение для пары:",
  "title": "Непрерывное слушание",
  "url": "/techniques/непрерывное-слушание/"
}
