{
  "author": "Арина",
  "category": "Общие психологические знания",
  "content": "**Депрессия** – это распространенное и серьезное психическое расстройство, негативно влияющее на настроение, образ мыслей и поведение. К счастью, это заболевание излечимо. Депрессия вызывает чувство грусти и/или потерю интереса к занятиям, которые раньше приносили удовольствие. Она может привести к разнообразным эмоциональным и психическим проблемам, а также снизить способность к выполнению ваших функций на работе и дома.\n\n## Симптомы\n\nСимптомы депрессии могут варьироваться от незначительных до серьезных и могут включать в себя:\n* чувство грусти или подавленное настроение;\n* потерю интереса к занятиям, которые увлекали раньше или потерю удовольствия от этих занятий;\n* изменение аппетита – снижение или набор веса, не связанные с диетой;\n* бессонницу либо слишком долгий сон;\n* потерю энергии или повышенную утомляемость;\n* возрастание количества бессмысленных физических действий (например, неспособность усидеть на месте, хождение туда-сюда, движения руками), либо замедление движений и речи (эти симптомы должны быть достаточно выраженными, чтобы их заметили окружающие);\n* чувства никчемности и вины;\n* сложности в мышлении, концентрации и принятии решений;\n* мысли о смерти или суициде.\n\n## Постановка диагноза\n\nДля постановки диагноза депрессии симптомы должны длиться не меньше двух недель и быть отличными от вашего обычного предыдущего состояния.\nТакже некоторые заболевания могут вызвать похожие симптомы, поэтому важно исключить общие медицинские причины.\n\nСогласно оценкам, депрессией страдает каждый пятнадцатый взрослый человек (6.7%) в каждом конкретном году. Каждый шестой человек (16.6%) испытывает депрессию когда-либо в своей жизни. Депрессия может возникнуть в любом возрасте, но, чаще всего, впервые возникает в период от позднего подросткового возраста до середины третьего десятка. Женщины более подвержены депрессии, чем мужчины. Некоторые исследования показывают, что каждая третья женщина испытывает депрессию хотя бы раз в жизни. Фактор наследственности (родители, дети, родные братья и сестры) оказывает существенное влияние (примерно 40%) на вероятность возникновения депрессии.",
  "date": "2023-02-13",
  "docx_url": "https://docs.google.com/document/d/1uRRlOaXSI_WQpXhF394UcGnXsNwkEZ3E/edit",
  "featured_image": "/images/grief.jpg",
  "needs_subscription": false,
  "title": "Что такое депрессия?",
  "url": "/articles/депрессия/"
}
