{
  "author": "Катя",
  "category": "Эмоции и чувства",
  "content": "«Стокгольмский синдром» или «синдром идентификации заложника» выглядит, как проявление симпатии со стороны жертвы по\nотношению к своему захватчику, агрессору, применяющему к ней насилие (*Annin, 1985*). В настоящее время тема стокгольмского\nсиндрома наиболее актуальна вследствие учащения актов насилия в общественных местах, в том числе в школах и университетах.\nО том, как можно проникнуться симпатией к нападающему, а также как обнаружить, что вы попались на этот крючок, расскажет\nнаша статья. Но сперва немного истории.\n\nПочему же этот феномен носит имя прекрасного шведского города – родины Карлсона? Всему виной – один пренеприятнейший\nинцидент, произошедший летом 1973 года. В тот день в Стокгольме одинокий бандит (позже к нему присоединился еще один)\nзахватил банк и взял четырех человек в заложники. Находясь в столь незавидном положении, под угрозой смерти, заложники\nтребовали от шведских властей, чтобы те выполнили все условия захватчиков. Сам по себе этот факт не слишком удивляет, не\nтак ли? Однако после освобождения заложников в результате грамотных действий шведской полиции, начали происходить странные\nвещи. Уже бывшие заложники заявили, что, находясь в плену, боялись именно полиции, а не своих пленителей, которым они\nпозже оплатили дорогостоящих юристов и в целом оказывали поддержку, выражали к ним сочувствие и сопереживание их дальнейшей\nсудьбе (*Serena, 2019*). Впоследствии один из похитителей был оправдан, после чего крепко сдружился с одной из бывших\nзаложниц. Другой же похититель, получивший серьезный срок, тем не менее сделался предметом обожания и получал множество\nписем от похищенных им прежде женщин.\n\nЧто же произошло? Почему люди, в отношении которых был совершен акт столь вопиющего насилия вдруг стали защитниками и\nобожателями своих бывших мучителей? Местный психиатр Нильс Бейерут, который в то время консультировал шведскую полицию\n(*Kamm, 1973*), придумал специальный термин, которым он объяснил поведение сотрудников банка – «Норрмальмсторгский синдром»\n(его-то потом и станут именовать «стокгольмским»). Строго говоря, именовать его «синдромом» не совсем верно, так как это\nскорее феномен, который психодинамическая традиция связывает с таким защитным механизмом психики, как «идентификация с\nагрессором». Оказавшись в ситуации насилия, человек зачастую испытывает огромный стресс и, не желая более пребывать в\nстоль опасном и страшном положении жертвы, начинает отождествлять себя с агрессором, перенимать некоторые его личностные\nчерты, копируя их и принимая за свои собственные. Вероятно, «стокгольмский синдром» является следствием из этого\nотождествления: заложник становится похожим на захватчика, после чего неминуемо чувствует схожесть и даже близость между\nним и собой. Отсюда иллюзорное понимание и сочувствие целям и мотивам агрессора, попытка оправдать и даже поспособствовать\nдействиям такого «родного», «понятного» и «близкого» человека.\n\nСам по себе «синдром» не опасен и не является ни в коей мере психическим заболеванием (*Grobar et al., 2018*). На самом\nделе, он даже способствует выживанию заложников, так как сочувствие потенциально действует в обе стороны – иногда мешая\nтеррористам хладнокровно убить захваченных. Опасность несут именно последствия подобного сопереживания: люди могут\nспособствовать целям захватчиков, укрывать их от полиции, в редких случаях даже жертвовать ради них собственной жизнью.\nВ каком-то смысле эти действия даже можно назвать оправданными, ведь жизнь заложника целиком зависит от его пленителя;\nпонимая, а скорее чувствуя это, захваченные в плен люди будут стремиться ублажить и пойти на поводу у тех, от чьего\nнастроения зависит, выживут они или незамедлительно погибнут. В то же время надежда, что агрессор смягчится, если\nбезоговорочно выполнять все его требования, заставляет людей безо всяких раздумий совершать самые разные действия в пользу\nзахватчиков, порой даже те, что напрямую противоречат здравому смыслу.\n\nХорошо, что по отчетам полиции, подобный феномен возникает всего лишь примерно в 8% случаев, то есть, является довольно\nредким явлением.\nИли нет? Дело в том, что «стокгольмский синдром» не исчерпывается только ситуациями реальных вооруженных захватов. Схожие\nпо принципу работы процессы могут возникать в целом ряде ситуаций и случаев, например, при семейном и сексуальном насилии\n(*Hill, 2019*), религиозных и национальных обрядах, лишении свободы, военных операциях, политических терактах и так далее.\nБолее того, нечто похожее нередко имеет место в авторитарных семьях или корпорациях. Иными словами – «стокгольмский\nсиндром» может подстерегать вас дома или на работе, вовсе не обязательно для этого сталкиваться с реальными вооруженными бандитами. В связи с этим необходимо понимать, какие факторы способствуют возникновению этого феномена, и научиться вовремя отдавать себе отчет, если с вами это произошло.\n\nСреди особенностей ситуации, способствующих возникновению «синдрома» можно выделить следующие:\n1. длительное нахождение в ситуации насилия;\n2. возможность установить эмоциональный контакт с агрессором;\n3. сильная зависимость от агрессора и наличие у агрессора более или менее «рациональных» причин для подобного поведения (им необязательно быть действительно рациональными, главное, чтобы жертве было легко поверить, что они являются таковыми, а насилие оправданным).\n\nИтак, если вы когда-нибудь почувствуете, что хотите исполнить все желания некоего человека, что понимаете его мотивы и\nиспытываете сочувствие, несмотря на то что из раза в раз он продолжает делать вам больно, спросите себя, а не попали ли\nвы в заложники, подобного сотрудникам одного далекого датского банка.\n\n## Литература\n1. Annin P., Hostages: Living in The Aftermath, 1985.\n2. Grobar M., Ethan Hawke, Noomi Rapace, Learn True Meaning Of 'Stockholm' Syndrome — Tribeca Studio, 2018\n3. Hill J., See What You Made Me Do: Power, Control and Domestic Abuse, 2019.\n4. Kamm H., Stockholm Police Seize 2 in Vault, Free 4 Hostages, 1973.\n5. Serena K., Stockholm Syndrome And The Strange Bank Robbery Behind It All That’s Interesting, 2018.",
  "date": "2023-01-12",
  "docx_url": "https://docs.google.com/document/d/1NPq0CjSz0bLVVxnWxhXb-gLZc2IZnOXi/edit",
  "featured_image": "/images/stokholm_syndrome.jpg",
  "needs_subscription": false,
  "title": "Стокгольмский синдром",
  "url": "/articles/стокгольмский-синдром/"
}
