{
  "author": "Арина",
  "category": "Самопознание",
  "content": "**Цель**: Помочь найти смысл и ценность в собственном опыте, исследуя свои сильные стороны.\n\nНаше восприятие себя сильно завязано на том, что мы о себе помним и как мы рассказываем о том, что помним. Часто\nлюди не замечают своих сильных сторон либо просто не используют их. Это может помешать в достижении поставленных\nцелей, в наполнении своей жизни смыслом.\n\nПри выполнении упражнения напишите историю своей жизни в трех частях: прошлое, настоящее и будущее. Вы можете\nпроявлять творческий подход, но важно подчеркнуть, что Ваша задача – сосредоточиться на своих сильных сторонах\nв каждом из трех разделов. Если есть возможность, Вы можете поделиться написанным со специалистом.\n\n**Инструкции/Подсказки для написания**:\n\n**Прошлое**: Напишите историю своего прошлого. Обязательно опишите трудности, которые Вы преодолели, и личные\nсильные стороны, которые позволили Вам это сделать.\n\n**Настоящее**: Опишите свою жизнь и то, кем Вы являетесь прямо сейчас. Чем Вы отличаетесь от своего прошлого «я»?\nКаковы Ваши сильные стороны сейчас? Как развивались Ваши сильные стороны? С какими проблемами Вы сталкиваетесь?\nКак Вы можете использовать свои сильные стороны для преодоления этих проблем?\n\n**Будущее**: Напишите о своем идеальном будущем. Как Ваша жизнь будет отличаться от нынешней? Как Вы можете\nиспользовать свои сильные стороны для достижения этого идеального будущего? Как будут расти Ваши сильные стороны?\nКаким человеком Вы надеетесь стать? Чем Вы будете отличаться от того, что есть сейчас? Чего бы Вы хотели достичь?\nНаконец, как Вы можете добиться этих целей?",
  "date": "2023-02-15",
  "docx_url": "https://docs.google.com/document/d/1ZKAuOb5_GRlO-dGNis50EDqWm3PDUBY-/edit",
  "featured_image": "/images/Techniques/жизненная история.png",
  "short_description": "основанная на сильных сторонах",
  "title": "Жизненная история",
  "url": "/techniques/жизненная-история/"
}
