{
  "author": "Арина",
  "category": "Межличностные отношения",
  "content": "Выполняйте его в течение двух недель следующим образом:\n\n1. Выберите приятное занятие для совместного выполнения. Пример: вместе играйте в настольные игры, занимайтесь\nспортом, танцуйте, ходите в кино, ужинайте, занимайтесь чем-то творческим, вместе занимайтесь садоводством –\nчем-то, что нравится Вам обоим.\n\n2. Выберите занятие, которое Вы оба считаете важным или значимым. Пример: организация совместных счетов,\nвыполнение домашних обязанностей, решение сложных вопросов по взаимному удовлетворению, совместное решение\nпроблемы или вклад в улучшение окружающего мира.\n\n3. Позже запишите, что произошло в Вашей жизни во время и по завершении занятий. Как эти занятия повлияли на\nваше настроение? Обратите внимание, какие хорошие события произошли во время и после завершения мероприятий.\nЗапишите то, что произошло, в дневник.\n\n4. Обратите внимание на то, что благодаря Вашему выбору и действиям произошли эти хорошие, важные, осмысленные\nи доставляющие удовольствие действия и события.\n\n5. Выполняйте 2 новых приятных, значимых или важных занятия каждый день в течение двух недель, прежде чем\nпереключаться на другое.\n\n**Источник**: https://www.counselling-directory.org.uk/memberarticles/practice-happiness-psychology-exercises-for-couples-under-stress",
  "date": "2023-02-15",
  "docx_url": "https://docs.google.com/document/d/1oopWl9h_ovlVuVQSv7ux0-xxsa9iG5wP/edit#heading=h.gjdgxs",
  "featured_image": "/images/Techniques/пары совместные действия.png",
  "short_description": "Упражнение для пары: совместное выполнение приятных, важных и осмысленных действий",
  "title": "Совместные действия для пар",
  "url": "/techniques/совместные-действия/"
}
