{
  "author": "Ксюша",
  "category": "Самопознание",
  "content": "**Инструкция**:\n1. Начертите квадрат и разделите его на две части по вертикали.\n2. Слева вписывается сфера жизни (можно несколько), справа – напротив нее – отмечается ее уровень развитости в\nвашей жизни (например, можно поставить оценку от 1 до 10).\n3. Квадрат можно заполнять дважды в месяц, либо только подводить итог месяца, а затем сравнивать изменения.\n4. По каждой сфере затем следует прописать действия, которые помогут ее развить. Сферу «работа», например, могут\nразвивать размещение резюме, прохождение курсов, участие в форумах и пр.\n\n**Источник**: https://www.b17.ru/article/kpt_tehniki/",
  "date": "2023-02-15",
  "docx_url": "https://docs.google.com/document/d/1TTWnDXPBDCzXT6zKTychHabOO89j0fw7/edit#",
  "featured_image": "/images/Techniques/квадрат баланса.png",
  "short_description": "**Инструкция**: 1.",
  "title": "Квадрат баланса",
  "url": "/techniques/квадрат-баланса/"
}
