{
  "author": "Катя",
  "category": "Межличностные отношения",
  "content": "Существует большое количество людей, чья жизнь подчинена поведению, пристрастиям, желаниям другого человека, и такая зависимость\nделает их несчастными. Созависимость в отношениях мешает полноценной жизни личности, ее самовыражению и самореализации, а также\nвыступает одним из ключевых факторов риска в процессе формирования тяжелых форм зависимости: токсикомании, алкоголизма, наркомании\n(*Соловьева, Шаповалова, 2020*).\n\nПсихологическая модель взаимодействия между людьми под названием «Треугольник Карпмана» была впервые описана американским\nпсихотерапевтом Стивеном Карпманом в 1968 году. Несмотря на то что изначально Карпман назвал эту схему «драматическим треугольником»,\nза ней закрепилось имя ее основателя. Что из себя представляет «треугольник Карпмана» и чем плоха такая модель взаимоотношений людей?\n\n**Треугольник Карпмана** – это одна из самых популярных моделей, описывающих созависимые деструктивные отношения. В ней участники\nпридерживаются одной из трех ролей: Жертвы, Преследователя или Спасателя (*Карпман, 2016*).\n\n1. **Роль Преследователя**. B этой роли человек много критикует, обвиняет других людей и приказывает им. Преследователь хочет\nдоминировать, потому что сам глубоко внутри уязвим и не уверен в себе. Он самоутверждается и отыгрывает собственные комплексы и\nстрахи за счет контроля над другими, не беря ответственность за происходящее.\n2. **Роль Спасателя**. В этой роли человек все время пытается помочь и дать совет (часто непрошенный). Так он надеется почувствовать\nсебя нужным и самоутвердиться за чужой счет. На самом деле ему невыгодно, чтобы жертва вышла из треугольника. Пока он спасает ее\nи вступает в схватку с Преследователем, он подпитывает свое чувство собственной значимости, повышает самооценку и может не решать\nсобственные проблемы.\n4. **Роль Жертвы**. Это самая важная роль в треугольнике Карпмана. Потому что каждый игрок в глубине души – Жертва. Человек в этой\nроли ведет себя так, будто он беспомощный, много жалуется и ищет, на кого бы сбросить ответственность. А еще Жертва жаждет внимания.\nЭта роль достаточно одобряема в глазах общества. Она может годами ничего не менять – ей просто нужен кто-то, кому она может\nпожаловаться (*Москаленко, 2000*).\n\n## Как работает треугольник\n\nПреследователь нападает на жертву. Жертва страдает и винит во всем других людей и обстоятельства. Спасатель защищает Жертву и\nпомогает ей убедиться в том, что она беспомощна и ничего не может. В этом конфликте никто не пытается решить проблему.\nНаоборот – все превращают проблему в трясину, которая засасывает еще сильнее.\n\nВ разных обстоятельствах мы можем играть разные роли. Например, в конфликте с партнером – Преследователя, в диалоге с боссом –\nЖертвы, в общении с другом – Спасателя. Каждая роль дает свою выгоду – мы это бессознательно считываем и вступаем в игру.\n\nВ основе созависимого поведения каждого участника лежит потребность в любви и в избавлении от мучительных и привычных переживаний,\nусвоенных в воспитавшей их системе созависимых отношений – чрезмерной тревоги, вины, одиночества, жалости к себе, обид,\nнеуверенности, раздражительности, гнева, отчаяния. Но использование ими любой роли из треугольника Карпмана усиливает эти измучившие\nих переживания и минимизирует возможность получения любви.\n\n## Как выйти из треугольника\n\nДраматический треугольник не встретить там, где люди обладают достаточно высоким уровнем осознанности, готовы к прямому диалогу\nи избегают манипуляций: как в свой адрес, так и в отношении других людей. При этом выход из «треугольника Карпмана» – длительный\nпроцесс.\n\nВажно проследить за собой и понять, какие роли вы выбираете.\n\n1. **Если вы играете в Жертву**, начните брать на себя больше ответственности. Отказывайтесь от непрошенных советов и примите тот факт,\n   что нравиться всем невозможно. В состоянии Жертвы много вторичных выгод. Человек их, как правило, не осознает, но на него они\n   влияют очень сильно. Одна из таких выгод – получить внимание, заботу и восхищение («Как ты только с этим справляешься?»).\n   Для Жертвы с такой вторичной выгодой страшный сон – лишиться внимания и участия других в ее жизни.\n3. **Если играете в Спасателя**, попробуйте деликатно спрашивать у других, нужна ли им помощь или совет. Если ничего не нужно,\n   позвольте человеку самому разобраться в ситуации.\n5. **Преследователям** важно научиться выражать мысли без критики и разговаривать с собеседниками спокойно и уважительно.\n\n## Итог\n\nИтак, можно выделить три роли, в которых люди вступают друг с другом в деструктивные взаимоотношения: Жертва, Спасатель и\nПреследователь. При этом в разных обстоятельствах люди могут играть разные роли. Эта модель взаимодействия не приносит счастья\nили удовлетворения ее участникам, поэтому важно отследить, преобладает ли в человеке какая-либо роль, и попробовать ее\nкорректировать.\n\n## Литература\n1. Карпман С., Жизнь, свободная от игр, 2016.\n2. Москаленко В. Д., Созависимость: характеристики и практика преодоления, 2000.\n3. Соловьева Е. А., Шаповалова В. Г., Теоретический анализ феномена созависимых отношений, 2020.",
  "date": "2023-01-11",
  "docx_url": "https://docs.google.com/document/d/1wZQ9zoAvwU-GzmxkdENwIvJlZQVheaKX/edit",
  "featured_image": "/images/codependency.jpg",
  "needs_subscription": false,
  "title": "Созависимость",
  "url": "/articles/созависимость-карпман/"
}
