{
  "author": "Ксюша",
  "category": "Работа с мыслями",
  "content": "**Время выполнения**: около 5 минут.\n\n**На что направлена техника**:\n- совладание с тревогой и другими неприятными для Вас эмоциями;\n- стабилизация эмоционального состояния;\n- рефлексия, развитие самосознания.\n\nВ ходе этого упражнения Вы будете наблюдать за работой своего сознания, представляя, что оно – белая комната, через которую проходят мысли. Выполнять упражнение можно в любом спокойном месте, сидя или лежа. Закройте глаза и сделайте несколько глубоких вдохов. Дышите медленно и ровно на протяжении всего упражнения.\n\n1. Представьте, что Вы находитесь в белой комнате среднего размера с двумя дверьми. (Вместо образа комнаты с\nдверьми можно взять более близкий Вам образ: например, фуникулер, на который пересаживаются мысли, или багажная\nлента в аэропорту и т.д.) Мысли входят в одну дверь и уходят через другую. Как только мысль появляется,\nконцентрируйтесь на ней и старайтесь отнести ее к категории оценочных или безоценочных. Пример оценочной мысли:\n«На завтрашнем выступлении я буду выглядеть глупо, надо мной будут смеяться»; пример безоценочной мысли: «Я\nиспытываю страх перед завтрашним выступлением, как же мне тревожно».\n2. Рассматривайте каждую мысль внимательно, с любопытством и состраданием до тех пор, пока она не уйдет. Не\nпытайтесь анализировать ее, только отмечайте, оценочная она или нет. Не оспаривайте ее, не старайтесь поверить\nили не поверить в нее. Просто осознавайте, что это – мысль, краткий миг Вашей мозговой активности, случайный\nгость Вашей белой комнаты.\n3. Остерегайтесь мыслей, которые Вы отнесли к категории оценочных. Они будут стараться завладеть Вами,\nзаставить Вас принять эту оценку. Смысл данного упражнения в том, чтобы отмечать, насколько «прилипчивы»\nоценочные мысли: как они застревают в Вашем сознании и как сложно от них избавиться. Вы определите, что мысль\nмучительна и оценочна по тому, как долго она остается в белой комнате, или по тому, что Вы начинаете испытывать\nкакие-либо эмоции в связи с ней.\n4. Старайтесь постоянно поддерживать ровное дыхание, сохранять ясный образ комнаты и дверей (или другого\nвыбранного Вами в начале упражнения места), следить за мыслями и классифицировать их. Помните, что мысль –\nэто просто мысль. Вы гораздо больше нее. Вы – тот, кто создает пространство, через которую мыслям позволено\nпроходить. У Вас их миллион, и они уходят, а Вы по-прежнему остаетесь. Мысль не требует от Вас никаких действий.\nМысль не обязует Вас верить в нее. Мысль – это не Вы.\n5. Просто наблюдайте, как мысли проходят через белую комнату. Позволяйте им проживать их недолгую жизнь и\nговорите себе, что они имеют право на существование, даже если они оценочные. Признавайте Ваши мысли, давайте\nим уйти, когда приходит время, и готовьтесь встречать новые – одну за одной.\n\nПродолжайте выполнять это упражнение до тех пор, пока не почувствуете, что Вы по-настоящему дистанцировались\nот своих мыслей. Делайте его, пока даже оценочные мысли не начнут проходить через комнату не задерживаясь.\n\n**Источник**: Маккей М., Скин М., Фаннинг П., «Когнитивно-поведенческая терапия для преодоления тревожности, страха, беспокойства и паники»",
  "date": "2023-02-12",
  "docx_url": "https://docs.google.com/document/d/1i2MZ6xT61o-nNKWLGj_rGm1LaqeldoPU/edit#heading=h.gjdgxs",
  "featured_image": "/images/Techniques/белая комната.png",
  "needs_subscription": true,
  "short_description": "Техника «»",
  "title": "Белая комната",
  "url": "/techniques/белая-комната/"
}
