{
  "author": "Арина",
  "category": "Межличностные отношения",
  "content": "*Лучше просить разрешения заранее, чем просить прощения впоследствии.*\n\n**Культура активного согласия** – это убеждения и практики, которые направлены на то, чтобы сделать любое социальное\n(в том числе сексуальное) взаимодействие обоюдно приятным, осознанным и добровольным.\n\nМы следуем принципам культуры активного согласия, когда ценим чувства людей, с которыми взаимодействуем.\nРечь идет о том, чтобы каждый раз уважать личные и эмоциональные границы друг друга. Это миф, что согласие важно только\nтогда, когда дело доходит до секса. Культура согласия выходит за рамки секса и применима к любым повседневным\nвзаимодействиям – от обмена чьей-либо фотографией в Интернете до вопроса о том, можно ли обнять человека.\n\n**Согласие должно быть**\n1. Добровольным\n2. Полным энтузиазма\n3. Трезвым\n4. Устным\n5. Без принуждения\n6. Непрерывным\n7. Честным\n\nВ контексте сексуальных/физических отношений отсутствие согласия является изнасилованием.\nТолько после того, как согласие будет озвучено, физические взаимодействия могут перейти на следующий уровень.\nРечь идет о взаимном удовлетворении, а не просто о сосредоточении на себе.\n\n## Влияние патриархата\n\nВ этом контексте важно рассмотреть параллели между социальным согласием и сексуальным согласием в патриархальном обществе.\nПатриархат создает и поддерживает культуру, благодаря которой мужчинам легче определять и поддерживать свои границы,\nчем женщинам и представителям других гендеров. Следовательно, концепция согласия сильно зависит от того, какой вес имеет\nиндивид в обществе. Отсутствие социальной свободы у женщин и представителей других гендерных идентичностей также\nпроявляется в их сексуальной жизни, и об этом нужно помнить всегда.\n\nКогда мы говорим о главной причине гендерного насилия, чаще всего мы говорим о патриархате. В патриархальном обществе\nраспространены гендерное насилие и культура изнасилования, которые затрагивают почти все слои и институты общества.\nЭто вредит не только угнетенным, но и угнетающим, ведь патриархат распространяет идеи о токсичной маскулинности\n(утверждения о том, что мужчина – хищник, охотник, не плачет, должен всегда быть сильным и др.).\n\nСексуальное насилие – распространенная проблема, о которой люди чаще всего умалчивают из-за социальной стигмы. Это включает в себя\nлюбую нежелательную сексуальную активность – нежелательные прикосновения, преследование, поддразнивание, изнасилование и т.д.\n\n## Что делать *не надо*, если вы *не хотите* поддержать культуру насилия\n\nНиже приведен список стереотипов и установок, которые поддерживают культуру насилия.\n\n1. Обвинение жертвы («она сама напросилась!»).\n2. Нормализация сексуального насилия («Мальчики всегда будут мальчиками»).\n3. Публичные шутки об изнасиловании и объективации.\n4. Терпимость к сексуальному насилию, игнорирование его проявлений.\n5. Распространение ложной статистики об изнасилованиях.\n6. Публичное изучение одежды жертвы, ее психического состояния, мотивов и истории, чтобы найти проблему в ней.\n7. Определение «мужественности» как доминирующей и сексуально-агрессивной черты.\n8. Определение «женственности» как покорной и сексуально-пассивной черты.\n9. Давление на мужчин, чтобы у них была цель «добиться».\n10. Давление на женщин, чтобы они не казались «холодными».\n11. Убежденность в том, что изнасилованию подвергаются только неразборчивые в связях женщины.\n12. Убежденность в том, что мужчин не насилуют или что насилуют только слабых мужчин.\n13. Отказ принимать обвинения в изнасиловании всерьез.\n14. Фокус на том, чтобы учить женщин избегать изнасилования вместо того, чтобы учить мужчин не насиловать.\n\n## Что *надо* делать, если вы *хотите* поддержать культуру согласия\n\nВы можете противостоять распространению насилия, если будете следовать следующим советам.\n\n1. Поймите, что такое согласие на самом деле и чем оно **не** является.\n2. Нормализуйте культуру согласия со своими друзьями и партнерами и имейте в виду, что согласие может быть отозвано в любой момент.\n3. Изучите, какие аспекты ваших собственных убеждений, установок и поведения нуждаются в пересмотре.\n4. Избегайте использования формулировок, которые объективизируют или унижают женщин.\n5. Не торопитесь обвинять жертву.\n6. Высказывайтесь, если вы слышите, как кто-то другой отпускает оскорбительную шутку или нормализует изнасилование.\n7. Критически анализируйте сообщения СМИ о женщинах и насилии.\n8. Проявляйте уважение к физическому пространству других людей даже в случайных ситуациях.\n9. Всегда общайтесь с сексуальными партнерами и не предполагайте автоматического согласия.\n10. Не позволяйте стереотипам о мужественности или женственности влиять на ваши действия.\n11. Участвуйте в образовательных и информационно-пропагандистских мероприятиях, чтобы распространять информацию среди других.\n\n## Как говорить нет\n\nСказать «нет» может быть действительно тяжело, особенно если вы чувствуете, что склонны угождать людям.\nКак вы можете вежливо стоять на своем, не чувствуя себя виноватым?\n\n### Вежливый отказ\nЧтобы вежливо отказать, нужно дать понять собеседнику, что вы:\n- поняли его;\n- эмпатичны к нему («я понимаю, что это важно для тебя»);\n- тоже имеете свои потребности;\n- отказываете («поэтому отказываю»);\n- и не испытываете чувства стыда и страха.\n\nНо если вы не хотите ничего объяснять – простого «нет» уже достаточно.\n\n### Стойте на своем\nНекоторые люди не всегда принимают «нет» за ответ. Если ваш первый отказ не донесет суть, будьте настойчивы.\nСкажите еще раз, что вы не сможете удовлетворить их просьбу и что вы не собираетесь менять свое решение.\nЭто нормально – быть твердым, особенно если собеседник не отступает. Помните – вы не обязаны помогать, и вы не плохой человек, если говорите «нет».\n\nЕсли надоедливый ухажер не отстает от вас, вы можете ответить: «Как я уже сказала, мне это не интересно, отойдите от меня»\nили «Еще раз повторяю, нет. Если вы не прекратите, я позову охрану или закричу».\n\n### Практикуйтесь\nГоворить «нет» со временем становится легче. Ищите простые, элементарные возможности сказать «нет» в своей повседневной жизни.\nМожет быть, ваш коллега предложит вам выпить кофе, или продавец в кофейне спросит, не хотите ли вы положить лук на свой сэндвич.\nНебольшие, простые отказы могут помочь вам обрести уверенность в себе по мере того, как вы будете продвигаться к более серьезным разговорам.\n\n## Разрушает ли культура согласия романтику\n\nСовсем нет! Спрашивая разрешения и прося озвучить согласие, вы показываете, что заботитесь о безопасности и комфорте своего партнера,\nцените и уважаете его. Если же вы познакомились недавно, то предосторожность точно не повредит. Кроме того, это поможет вам ближе познакомиться\nи избежать неприятных ситуаций.\n\nСогласие не обязательно должно звучать как строчка из порнофильма или клятва под присягой. Самое важное – это уметь прислушаться к тому, кто рядом.\n\n## ПАМЯТКА О САМОМ ГЛАВНОМ:\n\n***Нет – значит нет***\n\n***Захотелось – спроси***\n\n***Не хочешь – откажи***\n\n## Рекомендации:\n\nКороткие анимированные видео о культуре согласия:\n\n1. [Enthusiastic Consent!](https://www.youtube.com/watch?v=AqBQH1e7XwQ)\n2. [Tea and Consent](https://www.youtube.com/watch?v=pZwvrxVavnQ)\n3. [Cycling Through Consent](https://www.youtube.com/watch?v=-JwlKjRaUaw)",
  "date": "2022-12-07",
  "docx_url": "https://docs.google.com/document/d/1eFXdcFF8fc_B2zq54S6xIrTnNlDZDzYq",
  "featured_image": "/images/consent_culture.jpg",
  "title": "Культура согласия",
  "url": "/articles/культура-согласия/"
}
