{
  "author": "Катя",
  "category": "Расслабление, снижение тревоги и беспокойства",
  "content": "Если Вы склонны к гипотетическому беспокойству (например, к мыслям «А вдруг…?»), для Вас может оказаться\nполезной̆ практика отслеживания этих мыслей и затем перенаправления внимания на вещи, действительно находящиеся\nв рамках Вашего контроля.\n\nИсследования показывают, что когда мы направляем наш фокус на то, что можем контролировать, мы можем обнаружить\nзначимые и устойчивые различия в хорошем самочувствии, здоровье и продуктивности.\n\nИтак, нарисуйте таблицу, где слева укажите все то, что Вы можете контролировать, а справа – те вещи и явления,\nкоторые не подлежат Вашему контролю, как в примере, указанном ниже. После этого ориентируйтесь на список слева\nв моменты, когда чувствуете тревогу и стресс.\n\n|          **В пределах моего контроля**          |   **За пределами моего контроля**   |\n|-------------------------------------------------|-------------------------------------|\n| Повышение устойчивости                          | Решения, принимаемые другими людьми |\n| Следование последней информации и рекомендациям | Здоровье других людей               |\n| Фокус на том, что важно для меня                | Новости                             |\n| Моя информационная диета                        | Действия правительства              |\n| Мои повседневные обязанности                    | Открытие/закрытие школ              |\n| Расслабление                                    | Состояние системы здравоохранения   |\n| Развитие социальных связей                      | Отмененные рейсы и праздники        |\n| Хорошее питание                                 | Торговля и перевозки                |\n| Физические упражнения                           | Общественный транспорт              |\n| Поиск и предложение поддержки                   | Взросление/старение                 |\n| Право голоса и активная позиция                 | Погода                              |\n\n**Источник**: https://thewellnesssociety.org/free-coronavirus-anxiety-workbook/",
  "date": "2023-02-20",
  "docx_url": "https://docs.google.com/document/d/1R0bQDY_pbRNpXX6P7fzTNCkYqi8_2qAf/edit#",
  "featured_image": "/images/Techniques/практика для снижения беспокойства.png",
  "short_description": "Практика на определение зон контроля для снижения беспокойства",
  "title": "Определение зон контроля",
  "url": "/techniques/определение-зон-контроля/"
}
