{
  "author": "Арина",
  "category": "Психология и практика",
  "content": "Самобичевание, самоуничижительные высказывания сильно ухудшают качество\nжизни человека. Негативное отношение к себе связано с уменьшением\nсклонности к тому, чтобы заводить новых друзей, менять карьерный план и\nпринимать ответственность (McKay & Fanning, 2016).\n\nИсследования показали, что самооценка является внутренним индикатором\nтого, в какой степени наша \"потребность в социальной интеграции\nудовлетворена\" (Orth & Robins, 2019, стр. 336).\n\nВ этой статье будет рассматриваться понятие самооценки и методы ее\nразвития.\n\n## Что Такое Самооценка?\n\nСамооценка - это субъективная оценка, которая измеряется с помощью\nсамоотчета.\n\nКак правило, исследователи проводят различие между общей и\nпредметно-ориентированной самооценкой. Самооценка в общем относится к\nтому, как индивид оценивает свою ценность, в то время как специфика\nпредметной области указывает на чувство самоценности в отдельных\nобластях, таких как физическая внешность, отношения и интеллектуальные\nспособности (Orth & Robins, 2019).\n\n## Как развивается самооценка?\n\nХотя исследования показывают, что на общую самооценку влияют как\nгенетические факторы (примерно 40%), так и факторы окружающей среды,\nостается неясным, как именно она формируется в раннем возрасте (Orth &\nRobins, 2019).\n\nИсследование самооценки признает важность семейного окружения, включая\nкачество родительских отношений (Orth & Robins, 2019).\n\n## Насколько стабильна самооценка?\n\nСамооценка варьируется в зависимости от ситуации и возраста; большая\nчасть исследований предполагает, что она низкая в детстве, повышается в\nподростковом возрасте, достигает максимума во взрослом возрасте, а затем\nснижается при старении. Тем не менее, она остается относительно\nстабильной на протяжении всей нашей жизни , и \"имеющиеся данные\nподтверждают идею о том, что самооценка является устойчивой личностной\nхарактеристикой\" (Orth & Robins, 2019, стр. 331).\n\nЕсли мы не сосредоточимся на том, чтобы изменить это, если мы не уверены\nв себе в детстве, то, скорее всего, будем такими и во взрослой жизни.\n\n## Что влияет на развитие самооценки?\n\nМы все отличаемся в том, как меняется наша самооценка с течением\nвремени. На большую часть этих индивидуальных различий влияют, иногда\nкосвенно, следующие факторы (Orth & Robins, 2019):\n\n-   Пол и этническая принадлежность\n-   Социальные отношения\n-   Социально-экономический статус\n-   Успех в работе\n-   Стрессовые жизненные события\n-   Культурный контекст\n\nНапример, в некоторых культурах женщинам присваивается более низкий\nстатус, и в некоторых ситуациях к женщинам по-разному относятся на\nработе и в образовательной среде (Orth & Robins, 2019).\n\n## Как повысить самооценку\n\nКогда мы научимся отключать нашего внутреннего критика, мы сможем\nостановить цикл самосаботажа и восстановить контроль, прежде чем мы\nнанесем урон нашей самооценке.\n\n*Психотерапия*\n\nИсследования показывают, что психотерапия может повысить чувство\nсобственной значимости у клиентов. (McKay & Fanning, 2016). С проблемой\nсамооценки наиболее эффективно работает когнитивно-поведенческий подход\nпсихологии.\n\n*Принятие себя*\n\nЭто означает, то, что вы даете право себе право, быть самим собой. Вы не\nзанимаетесь отрицанием реальности, а действуете исходя из того, что\nимеете.\n\n## Три упражнения для повышения самооценки\n\n### Поймайте критика внутри себя\n\nКритика состоит из \"циклических негативных мыслей и эмоций, которые\nпревращают нашу уникальную способность к самоанализу скорее в проклятие,\nчем в благословение\" (Kross, 2021).\n\nПоймайте критика через самосознание.\n\nЧувство подавленности и пренебрежения к себе часто является результатом\nработы нашего внутреннего критика. Поэтому может быть полезно замечать\nкритику в момент ее проявления.\n\nПопробуйте выполнить следующие действия (McKay & Fanning, 2016):\n\n-   С закрытыми глазами сделайте несколько медленных, глубоких вдохов.\n-   Расслабьте свое тело, устраняя напряжение в плечах, ногах, животе,\n    лице, шее и плечевых суставах.\n-   Осознайте, где вы чувствуете напряжение в своем теле.\n-   Сосредоточьтесь на этой области своего тела и полностью осознайте,\n    как она себя чувствует.\n-   Прислушайтесь к своим мыслям, которые сопровождают чувства,\n    сосредоточившись на этой области тела. О чем говорят вам эти\n    мысли? Попытайтесь вспомнить, когда начались эти чувства. Что\n    говорит критик?\n\nРегулярное выполнение этого упражнения поможет вам лучше понять природу\nсамокритики.\n\n### Ответ критике\n\nОтвечать своему критику может показаться немного странным, но научиться\nотвергать негатив по отношению к себе - невероятно ценно.\n\nКогда вы наблюдаете за своим внутренним критиком на работе, попробуйте\nследующие два метода обратной связи (McKay & Fanning, 2016):\n\n#### *Какой ценой?*\n\nСпросите себя, какую цену я плачу за нападки моего внутреннего критика?\n\nСоставьте список того, во что вам обходится ваш внутренний критик.\n\nНапример:\\\nЯ избегаю общения с новыми людьми.\\\nЯ постоянно думаю, что люди на работе меня не уважают.\n\nОбъедините эти пункты в утверждения, которые вы можете использовать,\nчтобы бросить вызов критику:\n\nЯ не могу позволить себе жертвовать своей личной и профессиональной\nжизнью, из-за твоих нападок. Критик, ты того не стоишь.\n\n#### *Подтверждение ценности*\n\nЧтобы обезоружить критика, особенно с глубоко укоренившимися негативными\nубеждениями, вы должны научиться заменять его голос \"позитивным\nосознанием собственной ценности\" (McKay & Fanning, 2016, стр. 42).\n\nИ это нелегко. Вам нужно бросить вызов устоявшимся убеждениям и\nпризнать, что вы ценны как человеческое существо.\n\nМаккей и Фаннинг (2016, с. 42) предлагают следующие примеры утверждений:\n\nЯ стою того, потому что я дышу, чувствую и осознаю.\n\nЯ чувствую боль, я люблю, и я пытаюсь жить. Я хороший человек.\n\nВаша цель - создать заявление, которое кажется вам подлинным, которое вы\nможете использовать, чтобы заменить установки своего внутреннего\nкритика.\n\n## КПТ для повышения самооценки\n\nКогнитивная модель, связанная с Когнитивно-поведенческой терапией (КПТ),\nпредполагает, что дисфункциональное мышление существует при всех\nпсихологических расстройствах. Эмоциональному состоянию и поведению\nчеловека можно помочь, когда он \"научится оценивать свое мышление более\nреалистичным и адаптивным образом\" (Beck, 2011, с. 3).\n\nХотя существует множество инструментов и техник для повышения\nсамооценки, методы когнитивной реструктуризации оказались доказанно\nболее быстрыми и высокоэффективными.\n\n#### *Когнитивная реструктуризация*\n\nТерапевт начинает с изучения мыслей клиента. О чем вы думали или что вы\nговорили себе в моменте?\n\nКлиенту может быть полезно дать имя своему внутреннему критику. Придание\nголосу индивидуальности означает, что можно абстрагироваться и\nвоспринимать критика, как внешний фактор, а не как 'я'.\n\nПомимо критика, очень важно познакомиться со своим здоровым голосом (\n\\\"принимающим\\\" или \\\"рациональным\\\" агентом), тем, кто мыслит\nреалистично.\n\nТаким образом можно бросить вызов самому суровому критику, используя\nсвой здоровый голос.\n\nДалее,следует осознать, почему используется критический голос. Например,\nответив на эти вопросы:\n\n- Что говорил критик, когда вы знакомились с новыми людьми?\n- Как вы думаете, от чего критик пытался вас защитить?\n- Как критик делал это?\n\nВозможно, критик готовил вас к отказу или защищал вас, прося вас не\nвступать в контакт с неизвестностью.\n\nКак только функция критика будет лучше понята, можно спросить себя, что\nбы вы были вынуждены испытать, если бы критик не останавливал или не\nограничивал вас? (McKay & Fanning, 2016).\n\nКак критик помогает вам в этой или других подобных ситуациях?\n\nЧто может произойти, если заставить критика замолчать?\n\n## Выявление искажений\n\nИскаженный образ мышления также может снизить нашу самооценку. Определяя\nмножество типов искажений, их становится легче обнаружить, и становится\nвозможным заменить токсичный язык чем-то более точным.\n\nСократический опрос может быть мощным способом выявления логических\nнесоответствий в том, что говорится, и получения более точного\nутверждения (изменено по McKay & Fanning, 2016):\n\nВопросы, используемые для выявления чрезмерного обобщения:\n-   Это правда, что ты всегда все портишь?\n-   Ты хочешь сказать, что никогда ничего не делаешь правильно?\n\nВопрос, используемый для выявления ошибочной маркировки:\n-   Правда ли, что двойка по тесту означает, что вы терпите неудачу?\n\nВопрос, используемый для выявления отсутствия доказательств:\n-   Какие у вас есть доказательства того, что люди думают, что вы все\n    испортили?\n\nТакой опрос показывает, что наш внутренний голос не только неточен, но и\nневерен, и есть более здоровые способы оценить наши действия и\nповедение.\n\n## Заключение\n\nНесмотря на то, что наши гены влияют на самооценку, ее можно изменить\nосознанными действиями. Процесс развития самооценки несомненно требует\nусилий и времени, однако нельзя переоценить преимущества здорового\nотношения к себе.\n\n## Литература\n\n1. Beck, J. S. (2011). Cognitive behavior therapy: Basics and beyond.\nGuilford Press.\n\n1. Kross, E. (2021). Chatter: The voice in our head and how to harness it.\nVermilion.\n\n1. McKay, M., & Fanning, P. (2016). Self-esteem. New Harbinger.\n\n1. Orth, U., & Robins, R. W. (2019). Development of self-esteem across the\nlifespan. In D. P. McAdams, R. L. Shiner, & J. L. Tackett (Eds.),\nHandbook of personality development (pp. 328--344). Guilford Press.",
  "date": "2022-10-30",
  "docx_url": "https://docs.google.com/document/d/1MrMSZB-t0Bm0_Iq15fzeOwxHq8lskx9s",
  "title": "Самооценка и как ее улучшить",
  "url": "/articles/самооценка-и-как-ее-улучшить/"
}
