{
  "author": "Арина",
  "category": "Работа с эмоциями",
  "content": "Эти упражнения тренируют устойчивость нервной системы и увеличивают скорость адаптации при изменении внешних условий. Освоив эти упражнения, человек перестает быть «заложником эмоций», приобретает уверенность, что в каждой ситуации может контролировать эмоции.\n\n1. **«Назойливая муха».**\nСядьте удобно: руки свободно положите на колени, плечи и голову опустите, закройте глаза. Представьте, что на\nваше лицо пытается сесть назойливая муха. Она садится то на нос, то на губы, то на лоб, то на глаза. Ваша задача\n– не открывая глаз согнать насекомое. Через пару минут напряжение с мышц лица уходит, а вместе с ним и\nраздражение.\n\n2. **«Разобрать по косточкам».** Источником эмоций могут быть внешние события, а могут – внутренние стимулы:\nпамять, физическое состояние. Если эмоция, которую вы переживаете сейчас, имеет слишком высокий градус, сначала\nостыньте. Затем начните задавать себе вопросы:\n   - Как я испытываю злость (или любую другую эмоцию)?\n   - Почему я испытываю злость?\n   - Когда я уже испытывал/a злость?\n   - Как часто я злюсь?\n   - Чем злость мне помогает?\n   - Чем и где злость мешает?\n\nРазбор эмоции позволяет быстрее понять настоящую причину и источник реакции.\n\n**Источник**: https://mel.fm/blog/startupjunior/69321-11-uprazhneny-kotoryye-pomogut-luchshe-ponimat-svoi-i-chuzhiye-emotsii",
  "date": "2023-02-12",
  "docx_url": "https://docs.google.com/document/d/1_1pEtchSKpRvBtdN0Z676djwCrXmi5Yd/edit",
  "featured_image": "/images/Techniques/эмоциональная устойчивость.png",
  "short_description": "Упражнения для эмоциональной устойчивости",
  "title": "Эмоциональная устойчивость",
  "url": "/techniques/эмоциональная-устойчивость/"
}
