{
  "author": "Катя",
  "category": "Общие психологические знания",
  "content": "В настоящее время насчитывается от 600 до 1000 психотерапевтических подходов. В этой статье мы решили сделать краткий обзор\nэффективных психодинамических направлений, проверенных практикой и временем. Этот небольшой гайд может вам помочь расширить\nкругозор в области психотерапии, подобрать себе подходящего психолога или направление для обучения.\n\n## Психодинамический подход\n\nМетоды этого подхода концентрируются на бессознательном человека. Мысли, действия, поступки, желания, поведение – все это\nпроявления неосознанных процессов. Трудности человека – это результат борьбы между социальными нормами и бессознательными\nвлечениями и желаниями.\n\nПодход включает в себя содействие более глубокому пониманию своих эмоций и других психических процессов. Цель – помочь\nклиенту осознать внутренний конфликт и познакомиться с ним, облегчить наиболее очевидные симптомы, научить клиента\nвзаимодействовать со своими чувствами и побуждениями.\n\n### Психоаналитический метод\n\nФундаментом психодинамического подхода и психотерапии в целом является психоаналитический метод, основанный всеми\nизвестным Зигмундом Фрейдом. В основе теории лежит модель психики, состоящая из трех элементов: Оно (бессознательные\nинстинктивные желания), Сверх-Я (моральные и общественные нормы) и Я (сознательная часть личности). Между Оно и Сверх-Я\nпостоянно возникают конфликты, деятельность Я направлена на разрешение этих конфликтов (что может получаться не всегда).\nЦель терапии – «подсветить» конфликты, осознать неосознанные влечения, прожить болезненный опыт прошлого и высвободить\nподавленные чувства.\n\n**Что почитать:**\n- «Введение в психоанализ» З. Фрейд;\n- «Психопатология обыденной жизни» З. Фрейд;\n- «Невротическая личность нашего времени» К. Хорни;\n- «Психоаналитическая диагностика» Н. Мак-Вильямс.\n\n### Юнгианский анализ\n\nКарл Густав Юнг ввел понятие архетипа. Архетип – структура психики, часть коллективного бессознательного, формирующаяся в\nтечение всей истории человечества. Архетипы предрасполагают людей чувствовать, воспринимать и реагировать на внешний мир\nопределенным образом. Архетипов очень много, основные пять – Персона (маска, как мы ведем себя с другими), Тень (то, что\nчеловек в себе отвергает), Анима (женское начало в мужском), Анимус (мужское начало в женском), Самость (целостность). Цель\nюнгианского анализа – интегрировать в человеке противоречивое, все части личности, помочь ему достичь целостности.\n\n**Что почитать:**\n- «Архетипы и коллективное бессознательное» К. Юнг;\n- «Тысячеликий герой» Дж. Кембелл;\n- «Перевал в середине пути» Дж. Холлис.\n\n### Транзактный анализ\n\nТранзактный (также – транзакционный и трансакционный) анализ включает в себя модель психики, состоящую из трех Эго-состояний:\nВнутреннего Ребенка, Внутреннего Родителя и Внутреннего Взрослого. В состоянии Ребенка человек ведет себя так, как вел бы\nсебя в детстве. Это состояние выражается в спонтанности, любопытстве, умении радоваться, иногда в инфантилизме, поиске\nподдержки, внимания, в желании бунтовать, попытках угодить другим и т. д. Эго-состояние Родителя выражает образ значимого\nвзрослого из детства. В этом состоянии человек ведет себя, как вел бы себя родитель: заботится, поддерживает, помогает,\nсопереживает или ругает, карает, наказывает. Наконец, Эго-состояние Взрослого выражается в рациональном и логическом\nмышлении, в принятии решений, в ответственности. Это единственное Эго-состояние, которое находится в настоящем,\n«здесь-и-сейчас», не обращено в детство. Социальные взаимодействия (или «транзакции») анализируются для определения\nэго-состояния человека в качестве основы для понимания поведения. Когда одна из частей постоянно доминирует, а другая не\nфункционирует вовсе, возникают проблемы и конфликты. Цель метода – познакомить клиента со своими частями личности, научить\nменять эго-состояния и быть гибким.\n\n**Что почитать:**\n- «Игры, в которые играют люди» Э. Берн;\n- «Жизнь, свободная от игр» С. Карпман;\n- «Трансакционный анализ в психотерапии» Э. Берн.\n\n### Лакановский психоанализ\n\nМетод основан на понимании языка как способа структурировать человеческий разум. Символ является базой всех остальных\nпсихологический процессов и понятий. В модели психики выделяется три регистра – Воображаемое (представления о себе),\nСимволическое (все, связанное с языком, словами и письменной речью) и Реальное (все то, что связано с телом, и не может\nбыть символизировано, выражено через речь). Цель лакановского анализа – уменьшить страдание, распутать психические\nконфликты с помощью речи, найти адекватные способы наслаждения.\n\n**Что почитать:**\n- «Семинары» Ж. Лакан.\n\n### Терапия, фокусированная на переносе (ТФП)\n\nТФП – это структурированная последовательная терапия, которая ориентирована на людей с пограничной организацией личности.\nУ таких людей очень высокая эмоциональная неустойчивость, нет стабильного восприятия себя и близких людей. Их самооценка\nтакже неустойчива и зависит от последнего опыта взаимодействия с другими людьми. Человек с такой организацией личности либо\nобесценивает, либо идеализирует себя и других людей. Терапия, фокусированная на переносе, является одним из немногих\nподходов терапии с доказанной эффективностью в работе с пограничной организацией личности. Все паттерны общения человека\nпроявляются и во взаимодействии «психолог – клиент». Терапевт позволяет человеку проявиться, анализирует и выражает свои\nсобственные реакции на клиента. Работая с переносом, терапевт помогает клиенту осознать и прожить сильный эмоциональный опыт\nчерез безопасное взаимодействие. Цель терапии – улучшение функционирования клиента, уменьшение симптоматики, помощь клиенту\nполучать удовлетворение от взаимодействия с другими.\n\n**Что почитать:**\n- «Психотерапия, фокусированная на переносе, при пограничном расстройстве личности» Ф. Йоманс, Дж. Кларкин, О. Кернберг.\n\n## Литература\n\n1. Bornstein R. F., Maracic C. E., Natoli A. P., The psychodynamic perspective, 2018.\n2. Evans D., An introductory dictionary of Lacanian psychoanalysis, 2006.\n3. Rapaport D., The structure of psychoanalytic theory, 1960.\n4. Summers R. F., Barber J. P., Psychodynamic therapy: A guide to evidence-based practice, 2010.",
  "date": "2023-01-12",
  "docx_url": "https://docs.google.com/document/d/1jmgx2dSD61JIdS80-HiczxduCNH9dUeX/edit",
  "featured_image": "/images/psychodynamic_approach.jpeg",
  "needs_subscription": false,
  "title": "Психодинамический подход в психотерапии",
  "url": "/articles/психодинамический-подход/"
}
