{
  "author": "Арина",
  "category": "Психология и практика",
  "content": "У всех нас были ситуации, когда мы несмотря на горящий дедлайн и\nважность задачи никак не могли сконцентрироваться. В цифровую эпоху\nконцентрироваться на чем-то одном особенно сложно, ведь нескончаемый\nпоток информации, уведомлений и сообщений старается завладеть нашим\nвниманием.\n\nНеспособность сосредоточиться на текущей задаче - одна из болезней\nнашего времени. Именно поэтому проблема улучшения способности\nфокусироваться так актуальна.\n\n## Факторы, влияющие на концентрацию\n\n**Гаджеты.** В процессе выполнения какой-либо задачи на нас обрушивается\nогромное количество информации из компьютера, телефона или телевизора.\nИсследователи обнаружили, что наш мозг настолько настроен на это\nотвлечение, что просто вид нашего смартфона ухудшает нашу способность\nконцентрироваться.\n\n**Недостаточный сон**. Ученые обнаружили, что недостаток сна может\nпривести к замедлению мыслительных процессов и снижению концентрации\nвнимания. В результате недостаточного сна ваша способности выполнять\nзадачи, особенно связанные с мышлением или логикой, могут серьезно\nпострадать.\n\n**Недостаточная физическая активность**. Вы когда-нибудь замечали, как\nэнергичные физические упражнения заставляют вас чувствовать себя более\nрасслабленным и энергичным в течение всего дня? Когда вы не занимаетесь\nфизической активностью, ваши мышцы могут стать напряженными. Вы можете\nпочувствовать стеснение в шее, плечах и груди, и такой постоянный\nдискомфорт может повлиять на вашу концентрацию.\n\n**Пищевые привычки**. То, что мы едим, влияет на наше самочувствие, в\nтом числе и на ясность ума в течение дня. Если мы не насыщаем наш мозг\nнеобходимыми питательными веществами, мы начинаем испытывать такие\nсимптомы, как потеря памяти, усталость и отсутствие концентрации. Диета\nс низким содержанием жиров может нарушить концентрацию внимания, потому\nчто мозг нуждается в определенных незаменимых жирных кислотах.\n\nОграничительные диеты могут негативно повлиять на концентрацию внимания,\nне обеспечивая мозг необходимыми питательными веществами или вызывая\nчувство голода, тяжесть или плохое самочувствие в организме, которые\nотвлекают сами по себе.\n\n**Окружающая среда.** В зависимости от того, что вы делаете, окружающая\nсреда может повлиять на ваше внимание. Очевидно, что слишком громкий\nуровень шума является проблемой, но многие люди также испытывают\nтрудности с концентрацией внимания, когда слишком тихо. Важен не только\nобщий уровень шума, но и тип шума: расслабляющая музыка или звуки дрели.\nКомфортный уровень освещенности и влажности, а также оптимальная\nтемпература положительно сказываются на концентрации.\n\n**Эмоциональное состояние**. Негативные эмоции, стресс негативно\nсказываются на концентрации. Интенсивное позитивное переживание так же\nможет затруднять процесс работы.\n\n**Здоровье**. Такие заболевания, как диабет, гормональный дисбаланс и\nнизкое количество эритроцитов, могут повлиять на нашу концентрацию.\nНекоторые лекарства также вызывают у вас сонливость или головокружение и\nсерьезно ухудшают внимание.\n\n**Вредные привычки.** Образ жизни, который включает в себя чрезмерное\nупотребление алкоголя, курение может бросить вызов нашей памяти и\nспособности концентрироваться и сосредотачиваться.\n\nЕсли вы считаете, что ваши способности к концентрации выходят за рамки\nнормы проконсультируйтесь со специалистом.\n\n## Что может помочь вам лучше сосредоточиться?\n\nУстраните отвлекающие факторы.\n\nВозьмите за правило выделять время в своем расписании для выполнения\nопределенной задачи. Попросите, чтобы вас не отвлекали ваши близкие или\nколлеги. Или изначально выберете место, где другие вряд ли потревожат\nвас: библиотеку, коворкинг, отдельную комнату.\n\nЗакройте социальные сети и другие приложения, отключите уведомления и\nдержите телефон в сумке или рюкзаке. Исследователи обнаружили, что\nкогнитивные способности были значительно улучшены, когда телефон был вне\nполя зрения, а не просто выключен.\n\nИсключите многозадачность. Попытка выполнять несколько действий\nодновременно заставляет дает иллюзию продуктивности. Но, увы, это\nприводит лишь к обратному эффекту - снижению производительности. При\nэтом многозадачность часто приводит к эмоциональному выгоранию. Примеры\nмногозадачности включают в себя прослушивание подкаста во время ответа\nна электронное письмо или разговор с кем-то по телефону во время\nнаписания отчета. Такая многозадачность не только мешает вам\nсосредоточиться, но и ставит под угрозу качество вашей работы.\n\nПрактикуйте внимательность и медитацию. Медитация или практика\nосознанности могут улучшить самочувствие и психическое здоровье, а также\nулучшить концентрацию. Во время медитации наш мозг становится более\nспокойным, а наше тело расслабляется. Попробуйте пару минут посидеть с\nзакрытыми глазами и сконцентрировать свое внимание на дыхании. По началу\nвам в голову будут приходить различные мысли, замечайте их и\nпостарайтесь отпускать. Сфокусируйтесь на ощущениях в теле,\nпоследовательно расслабляйте мышцы. Регулярно практикуя медитации, вы с\nбольшой вероятностью станете более продуктивным.\n\n## Литература\n\n1. McDiarmid C. Concentration //Probabilistic methods for algorithmic discrete mathematics. – Springer, Berlin, Heidelberg, 1998. – С. 195-248.\n2. Csikszentmihalyi M., Csikzentmihaly M. Flow: The psychology of optimal experience. – New York : Harper & Row, 1990. – Т. 1990.\n3. Styles E. The psychology of attention. – Psychology Press, 2006\n4. Compton R. J. The interface between emotion and attention: A review of evidence from psychology and neuroscience //Behavioral and cognitive neuroscience reviews. – 2003. – Т. 2. – №. 2. – С. 115-129..",
  "date": "2022-10-30",
  "docx_url": "https://docs.google.com/document/d/1EK6JL9ot1dNLtj34VkcPqRg6Irka2AuN",
  "title": "Как улучшить концентрацию и внимательность",
  "url": "/articles/как-улучшить-концентрацию-и-внимательность/"
}
