{
  "author": "Катя",
  "category": "Работа с эмоциями",
  "content": "Как и другие чувства, чувства злости и гнева являются нормальными человеческими переживаниями, требующими\nсвоего признания и выражения. В то же время выражение этих чувств не должно приводить к причинению ущерба\nсебе и другим. Переживание чувств злости и гнева может побуждать человека к изменению сложившейся системы\nотношений, являться стимулом к более решительным действиям. Часто эти чувства появляются в тех случаях,\nкогда человек чувствует себя недооцененным, обделенным, игнорируемым, отвергнутым, непонятым, а также когда\nвозникает угроза его интересам. Эти чувства также нередко возникают в ответ на агрессию извне, при\nпереживании боли и психической травмы. Злость, гнев и ярость, как правило, входят в структуру переживаний,\nхарактерных для посттравматических состояний.\n\nЛичность может по-разному относиться к подобным чувствам: одни позволяют себе их открыто выражать, другие\nсклонны эти чувства подавлять. Нередко открытому выражению злости и гнева мешает страх потери над ними\nконтроля, причинения ущерба окружающим, либо представления о моральной недопустимости этих переживаний.\nПризнание естественности и даже необходимости этих чувств способствует обретению способности ими управлять и\nнаходить оптимальные способы их выражения.\n\nДанное упражнение позволяет выразить эти чувства в метафорической, изобразительной форме и может\nслужить основой для развития навыков управления своим гневом.\n\n**Рекомендуемое время на выполнение упражнения**: 45-60 минут.\n\n**Материалы**: белая бумага размером А3; старые газеты и журналы с иллюстрациями; клей, ножницы.\n\n## Инструкция по выполнению упражнения\n\n### Подготовка\nПостарайтесь вспомнить различные проявления чувств злости и гнева на эмоциональном и физическом уровне,\nвозможно, внутренне обращаясь к какому-то событию из Вашей жизни.\n\n### Основная часть\n1. Просмотрите иллюстрации в газетах и журналах и подберите несколько картинок, которые бы отвечали на\nвопрос «На что похожи мои чувства злости и гнева?». При выполнении данного упражнения лучше пользоваться\nизображениями неодушевленных предметов (природные и неприродные объекты).\n2. Вырежьте эти картинки.\n3. Посмотрите на вырезанные картинки, передающие Ваши чувства злости и гнева, и постарайтесь описать\nследующие характеристики, связанные с изображенными объектами или их группами:\n   - масса, размер, текстура и температура;\n   - ощущения, которые возникали бы у Вас, если бы Вы взяли один или несколько объектов в свои руки;\n   - какие звуки способны произвести данные предметы;\n   - какие звуки вы хотели бы произвести с помощью данных предметов (предмета);\n   - что мог бы сказать этот предмет (предметы);\n   - где этот предмет (предметы) находятся;\n   - являются ли эти предметы неподвижными или они движутся;\n   - если они движутся, то как, в каком ритме и с какой скоростью.\n4. Вновь посмотрите иллюстрации в газетах и журналах и подберите один или несколько рисунков, которые могли\nбы служить «помощниками» предметам, изображенным на предыдущих картинках.\n5. Перемещая первые и вторые рисунки на листе бумаги, постарайтесь найти для них оптимальное расположение\nотносительно друг друга и затем приклейте их.\n6. Дождитесь, чтобы чувства злости и гнева, проявившиеся в процессе работы, стабилизировались, и чтобы Вы\nпочувствовали себя достаточно спокойно.\n\n### Описание и самоанализ\n1. Опишите, что произвело на Вас наиболее сильное впечатление в этом упражнении.\n2. Поясните, что общее между чувствами злости и гнева и найденными Вами рисунками.\n3. Опишите качества выбранных вами предметов-«помощников». Как они «помогают» предметам, ассоциирующимся со\nзлостью и гневом?\n4. Поясните, почему Вы расположили те и другие картинки именно таким образом?\n5. Что предметы-«помощники» могут символизировать в Вашей жизни, как это может помочь Вам лучше выражать\nчувства злости и гнева?\n6. Подумайте, какие еще способы конструктивного выражения этих чувств возможны.\n7. Подумайте, чем выражение чувств злости и гнева может быть для Вас полезно, к каким изменениям в Вашей\nжизни это могло бы привести.\n\n**Примечание**: Вы можете использовать данное упражнение для работы с другими чувствами – как положительными,\nтак и отрицательными.\n\n**Источник**: https://psy.wikireading.ru/21606",
  "date": "2023-02-12",
  "docx_url": "https://docs.google.com/document/d/1Nr0Xyx0WzAD72xoLUoEsvwQCsI3dE93-/edit#",
  "featured_image": "/images/Techniques/злость и гнев.png",
  "needs_subscription": true,
  "short_description": "Техника работы со злостью и гневом",
  "title": "Злость и гнев",
  "url": "/techniques/злость-и-гнев/"
}
