{
  "author": "Катя и Арина",
  "category": "Межличностные отношения",
  "content": "«Раз все так плохо, почему просто не уйти?» – очень распространенная реакция на рассказы об абьюзивных отношениях.\nАбьюз – термин, который пришел к нам из английского языка, в русском этот термин ближе всего к слову «насилие». Абьюз помимо физического бывает эмоциональным, экономическим, сексуальным и репродуктивным. Несмотря на кажущуюся сложность и непохожесть абьюзивных отношений, цикл абьюза везде одинаковый.\n\n## Цикл абьюза\n1. **«Ничего не предвещало беды»**. В начале отношений большая часть абьюзеров стараются казаться идеальными партнерами, они дарят подарки, дают почувствовать жертве свое обожание. Внимание и любовь рассеивают ее бдительность. Глаз замыливается и все «красные флажки» проходят мимо. Отношения завязываются очень быстро, чтобы жертва не успела одуматься и чтобы она отдавала контроль над собой.\n2. **Маска спадает**. Спустя время абьюзер начинает понемногу проявлять свою истинную сущность. Происходит активная проверка и нарушение личных границ. «Не одевайся так откровенно». «Эти друзья плохо на тебя влияют, не общайся с ними». При попытках сопротивления абьюзер использует манипуляции, газлайтинг (отрицание случившегося). Он постарается повернуть ситуацию так, чтобы жертва еще осталась виноватой.\n\n    Жертва в этот период проходит через несколько стадий. Она:\n    * **Терпит** в надежде, что скоро все будет как в начале отношений, а это лишь период.\n    * **Старается забыть** о все нарастающих проблемах и делает вид, что ничего не происходит\n    * **Старается изменить** абьюзера, ожидая что она может на него повлиять.\n    * **Меняет себя**. Жертва пытается подстроиться под непредсказуемое поведение абьюзера, следуя идее партнера о том, что проблема в ней(жертве).\n\n3. **Акт насилия**. Пиковая точка, после которой жертва может осознать ситуацию и попытаться уйти из отношений.\n4. **Вернуть любой ценой**. Абьюзер может начать извиняться, убеждать что жертва все не так поняла, попытаться все превратить в шутку или ошибку.\n5. **«Медовый месяц»**. Партнер становится «нормальным», может даже согласиться сходить к психологу, жертва же может передохнуть, увы, ненадолго.\nДалее круг замыкается, становится короче (без первого пункта), и быстрее.\n\n## Признаки абьюзивных отношений\n* **Подрывание самооценки и упреки**. Неуместные комментарии, обидные прозвища под соусом «я же любя». Со временем жертва может привыкнуть и начать думать о себе в негативном ключе, что облегчает контроль. «Кому ты кроме меня такой нужен?»\n* **Контроль**. Отслеживание передвижений, проверка социальных сетей, лишение финансов, приказной тон, отношение как к ребенку. Все конечно же оправдывается заботой.\n* **Вина**. Любимый инструмент абьюзеров. От жертвы будут требоваться постоянные оправдания даже за безобидные вещи, например, улыбка официантке.\n«Я столько для тебя сделала, а ты..»\n* **Обесценивание**. Увлечения жертвы глупы, проблемы надуманы, чувства преувеличены.\n\n## Проблема выхода из абьюзивных отношений\nК сожалению, причин, по которым выйти из абьюзивных отношений сложно, много, а их устранение часто почти невозможно без сторонней помощи. Разберем некоторые из причин.\n* **А по-другому и не бывает**. Часто происходит так, что жертва привыкла к абьюзивному сценарию отношений, усвоив его из романтической жизни своих родителей и окружения. Так же, нельзя сбрасывать со счетов культуру. Видели ли вы хоть одну мелодраму о здоровых отношениях? Вряд ли, ведь «все счастливые семьи похожи друг на друга, каждая несчастливая семья несчастлива по-своему». У жертв даже нет представления о том, как можно взаимодействовать с партнером, не смиряясь с манипуляциями и насилием.\n* **Ты этого достойна**. Из-за низкой самооценки жертва может считать, что лучше уже никогда не будет и «кому я такая вообще буду нужна».\n* **Эмоциональные качели**. Непредсказуемое чередование «кнута» и «пряника» делает жертву буквально зависимой от отношений. Нормальные взаимоотношения вызывают ломку от остроты ощущений.\n\n## Что делать?\n\n1. Возвращать круг общения. Друзья, родственники, группы поддержки. Вам нужна опора, не бойтесь просить о помощи.\n2. Действовать стоит без ведома абьюзера: создать финансовую подушку (продать что-нибудь, занять), найти место куда можно переехать, обратиться в [специализированные центры](https://nasiliu.net/karta-pomoshhi/)\n3. Оборвать **все** контакты с абьюзером и не реагируйте на его провокации, если он все же с вами свяжется.\n4. Заняться собой. Уделять время своему психологическому и физическому здоровью. Общаться с близкими людьми, заняться своими любимыми хобби.\n\nПомните, что вы заслуживаете любви и здоровых отношений.\n\nТест: [Есть ли в ваших отношениях психологическое насилие?](https://nasiliu.net/quiz/est-li-v-vashih-otnosheniyah-psihologicheskoe-nasilie2/)\\\nВидео: [Личный опыт домашнего насилия](https://youtu.be/CeeTtYLxsw4)\n\n## Что почитать об абьюзивных отношениях:\n-   Таня Танк [«Бойся, я с тобой»](https://www.litres.ru/tanya-tank/boysya-ya-s-toboy/)\n-   Ланди Бэнкрофт [«Почему он делает это? Кто такой абьюзер и как ему противостоять»](https://www.litres.ru/landi-benkroft/pochemu-on-delaet-eto-kto-takoy-abuzer-i-kak-emu-protivosto/chitat-onlayn/)\n-   Джексон Маккензи [«Psychopath Free. Как распознать лжеца и манипулятора среди партнеров, коллег, начальников и не стать жертвой обмана»](https://www.litres.ru/dzhekson-makkenzi/psychopath-free-kak-raspoznat-lzheca-i-manipulyatora-sredi-partnerov-kolleg-nachalnikov-i-ne-stat-zhertvoy-obmana/)\n-   Анна Пашкова [«Токсично. Как построить здоровые отношения и не вляпаться»](https://eksmo.ru/ebook/toksichno-kak-postroit-zdorovye-otnosheniya-i-ne-vlyapatsya-ITD957732/)\n-   [Ненасильственное общение, Маршалл Розенберг](https://www.ozon.ru/category/nenasilstvennoe-obschenie-marshall/)\n\n## Фильмы об абьюзивных отношениях:\n1. **Изчезнувшая** – при просмотре фильма сложно однозначно сказать, кто является абьюзером. Сюжет о загадочном исчезновении супруги смотрится бодро, а разрушение многих стереотипов о гендерных ролях греет душу.\n2. **Мама** – фильм является психологическим триллером, поэтому будьте готовы к непростым эмоциям. Однако присмотревшись поближе к действиям героев можно заметить всевозможные виды психологического давления и манипуляций.\n3. **Большие глаза**. Тут уже не просто абьюз, но и трудовая эксплуатация в мире художественного искусства цветущей Америки 50-х годов. Кристоф Вальц, как всегда, умопомрачителен в роли подлеца.",
  "date": "2022-10-30",
  "docx_url": "https://docs.google.com/document/d/1_so4XE6XVGVrl_iTFB0G9Lx_XJmvaL6O",
  "featured_image": "/images/abusive_relationships_1.jpg",
  "title": "Абьюзивные отношения",
  "url": "/articles/абьюзивные-отношения/"
}
