{
  "author": "Катя",
  "category": "Эмоции и чувства",
  "content": "Вина – чувство не очень приятное, но полезное для социализации. Переживая неловкость за плохой и вредный для других поступок,\nмы замечаем, когда и какие наши действия причиняют людям боль, узнаем об их границах и потребностях, развиваем в себе чуткость\nи внимательность. Поэтому механизм вины отчасти регулирует человеческие отношения и сигнализирует нам, когда мы действуем\nвразрез со своими ценностями.\n\nПроживая вину адекватно, мы готовы действовать, и в этом ее созидательная для психики функция. Человеку не нравится, что он\nсделал, и он хочет скорее исправить последствия поступка, компенсировать причиненный другому ущерб. Все это – пример того,\nкак конструктивно пережить вину (*Miceli, Castelfranchi, 2018*).\n\nЕсть и другая вина – деструктивная (или невротическая). Она бесполезна и разрушительна. Можно годами ощущать себя виноватым\nбез причины. Психоаналитик Карен Хорни описывает случаи, когда человек считает, что не заслуживает ничего, кроме страданий,\nили фоново ожидает упреков и недовольства от любого, кто вступает с ним в контакт. В споре он слепо принимает сторону оппонента,\nа если собеседник исчез из поля зрения – например, не отвечал на сообщения какое-то время – такой человек моментально обвинит в\nэтом себя (*Хорни, 1993*).\n\nКонструктивная форма вины связана с конкретными ситуациями и поэтому осознается. Деструктивная вина, наоборот, как правило,\nне осознается и присутствует в жизни человека как фон.\n\nЗдесь мы разберемся, как устроена вина, какой она бывает и чем она отличается от стыда.\n\n## Чем чувство стыда отличается от чувства вины\n\nСуть различий между ними в том, что чувство вины направлено как бы вовне, а стыд направлен внутрь.\n\nВина возникает в момент выбора. Когда мы выбирает один объект, мы чувствуем вину перед другим. Стыд же всегда затрагивает\nотношения с самим собой. И хотя мы говорим, что нам стыдно перед друзьями или коллегами, взгляд других людей – это зеркало,\nв котором отражается наше представление о себе. Стыд возникает, когда наше истинное «Я» сталкивается с идеальным образом самого\nсебя и не выдерживает несоответствия.\n\nСтыд может быть сформирован значимыми фигурами в прошлом. Например, родители одергивали эмоционального ребенка, потому что\nбыть шумным, громким, эмоциональным – стыдно. Ребенок воспринимал многочисленные «нельзя» как осуждение и отвержение.\nВпоследствии человек продолжает жить, ориентируясь на окружающих и воспринимая себя неуместным и жалким.\n\n## Вина, стыд и ответственность\n\nНормальное чувство вины – это опыт ответственности. Человек переживает, что в результате его действий кому-то в мире стало\nплохо. Возможно, этот поступок был для него важным, но близкому причинил боль или обернулся нежелательными последствиями.\nТак как прошлое изменить нельзя, остается исправить настоящее и будущее (*Julle-Daniere et al., 2020*).\n\nЧувство вины основывается на негативной оценке моральности своих действий, поступков, убеждений. Конструктивная вина связана с\nпринятием ответственности за свои поступки, которые принесли вред другим людям. Осознание ответственности за реальную вину –\nэто важный момент. В таком случае человек не станет оправдываться за содеянное, а скорее объяснит, какие обстоятельства\nпобудили его поступить таким образом. Например, он скажет: «Знаю, что подвел тебя, не одолжив денег, но у меня были на них свои\nпланы» (*Niehues, 2010*).\n\nСтыд, наоборот, не связан с вопросами ответственности. Он связан с воспринимаемым несоответствием между реальным и идеальным «Я»,\nкогда человек считает, что он не похож на идеальный образ себя. Например, он может стыдиться своих недостатков, может также\nиспытывать стыд (а не чувство вины) за совершенную им ошибку.\n\n## Деструктивная вина\n\nДеструктивная вина заставляет чувствовать себя ничтожным, камнем преткновения, когда поводов для этого нет. Человек берет\nна себя ответственность за то, к чему не причастен.\n\nНапример, в романтической паре один человек имеет замкнутый характер: время от времени «уходит в себя». А второй чувствует\nстрах, тревогу или возмущение. Он считает себя причиной меланхоличного настроения партнера и требует от того или подтверждения,\nили опровержения, что приводит к неконструктивному конфликту (*Хорни, 1993*).\n\n## Из-за чего может возникнуть деструктивная вина\n\nЕсли мама злилась, тревожилась и не объясняла, что происходит, ребенок делал вывод, что маме с ним плохо. И верил, что может\nвсе исправить. Ребенок приписывал себе авторство над родительским настроением и привык угадывать эмоции тех, кто рядом.\nДругой пример – враждебная атмосфера, где ребенка игнорируют. Злость нельзя направить на взрослых: это может быть опасно.\n\n## Что с этим делать\n\nСперва нужно найти источник вины, переосмыслить опыт и увидеть его с другой стороны. Ведь правда в том, что автором настроения\nмамы была она сама, но не знала, как с этими чувствами обойтись и как их доступно объяснить ребенку. Важно мысленно вернуть\nответственность другим людям за их состояние.\n\nЗатем нужно отреагировать, то есть, прожить и выразить чувства, которые возникали в прошлых ситуациях: например, выразить\nстрах потерять мамину любовь или злость за то, что она не удовлетворяла ваши потребности.\n\nВажно отыскать в себе собственные ориентиры и ценности и начать им следовать.\n\n## Итог\n\nИтак, нормальное чувство вины – это опыт ответственности. Вина может быть полезной в рамках общества. Однако есть и\nдеструктивная вина, которая может преследовать человека долгие годы. Она заставляет человека чувствовать себя ничтожным.\nСтоит отличать вину от стыда: вина направлена наружу, стыд направлен внутрь. Важно выражать, проговаривать, признавать эти\nчувства для того, чтобы в них не застревать.\n\n## Литература\n\n1. Хорни К., Невротическая личность нашего времени, 1993.\n2. Julle-Danière E., Whitehouse J., Vrij A., Gustafsson E., Waller B. M., The social function of the feeling and expression of guilt, 2020.\n3. Miceli M., Castelfranchi C., Reconsidering the differences between shame and guilt, 2018.\n4. Niehues J., The social and sociological significance of ‘guilt’: Exemplification of “guilt” in the historical context of post-war Germany, 2010.",
  "date": "2023-01-11",
  "docx_url": "https://docs.google.com/document/d/1zKen0cZj_mf0w98z45bCOHbNiWokzeT2/edit#",
  "featured_image": "/images/fault.jpg",
  "needs_subscription": true,
  "title": "Чувство вины",
  "url": "/articles/чувство-вины/"
}
